{
  "schema": "engagement-home-compare-citywide-readiness/v1",
  "input": {
    "lifecycle": {
      "schema": "engagement-home-compare-citywide-source-lifecycle/v1",
      "semantic_identity": "sha256:3d159c0d827734e2b59e9bdcefca902ba08403d7da363fa4889056ff75304b09",
      "sha256": "sha256:32720cf76bda915d8f9edbcb58f98fd8aa431558858ef14bf4a2c8020036b218",
      "bytes": 24101
    },
    "ledger": {
      "schema": "engagement-home-compare-citywide-join-dq/v1",
      "semantic_identity": "sha256:f717464a0ea33b5b611a6acf6e0d364a3d46f373a446b9557b954513d8cdcc3d",
      "sha256": "sha256:0bafac891d05da4d8cd32839d51513a9da7867959fc1a0e558af84be223b626e",
      "bytes": 7533
    }
  },
  "status": "partial",
  "sources": [
    {
      "source_id": "citygeo-address-locator",
      "ordinal": 0,
      "receipt_identity": "sha256:8f75febaffb93553da0511911efe4daf7c90726a42fce2e6a65d888d1dd8d9d9",
      "status": "unavailable",
      "freshness": {
        "status": "unavailable",
        "max_age_days": 1,
        "age_days": null
      },
      "clocks": {
        "source_as_of": null,
        "retrieved_at": "2026-08-29T19:08:32.165Z",
        "built_at": null,
        "observed_at": "2026-08-29T19:08:32.165Z"
      },
      "coverage": {
        "scope": "citywide",
        "status": "unavailable",
        "row_count": null,
        "available_zero": false,
        "exact_payload": false,
        "completeness_admitted": false
      },
      "dq": {
        "status": "unavailable",
        "observed_field_count": 18,
        "missing_fields": [],
        "flags": [
          "source-unavailable"
        ]
      },
      "official_source_url": "https://citygeo-geocoder-pub.databridge.phila.gov/arcgis/rest/services/Geocoders/Address_Locator/GeocodeServer",
      "limitations": [
        "City geocoder readiness does not admit a citywide address payload or address-level join."
      ]
    },
    {
      "source_id": "opa-current-property",
      "ordinal": 1,
      "receipt_identity": "sha256:5e724c54700be4f0e8b2a10375dea8c566b8fa37e8bd2d6c7cb5f6059131bf8f",
      "status": "unavailable",
      "freshness": {
        "status": "stale",
        "max_age_days": 2,
        "age_days": 10.105441724537037
      },
      "clocks": {
        "source_as_of": "2026-08-19T16:36:42.000Z",
        "retrieved_at": "2026-08-29T19:08:32.165Z",
        "built_at": null,
        "observed_at": "2026-08-29T19:08:32.165Z"
      },
      "coverage": {
        "scope": "citywide",
        "status": "unavailable",
        "row_count": null,
        "available_zero": false,
        "exact_payload": false,
        "completeness_admitted": false
      },
      "dq": {
        "status": "unavailable",
        "observed_field_count": 82,
        "missing_fields": [],
        "flags": [
          "source-unavailable"
        ]
      },
      "official_source_url": "https://data.phila.gov/visualizations/property-assessments/",
      "limitations": [
        "OPA current-property readiness does not admit a complete immutable parcel payload or private address-level join."
      ]
    },
    {
      "source_id": "opa-assessment-history",
      "ordinal": 2,
      "receipt_identity": "sha256:d9ef46db9dfd0f1aa59c6ac5a25d55d829dfac97dcfae1e80032eb0f0ab96707",
      "status": "partial",
      "freshness": {
        "status": "unavailable",
        "max_age_days": 45,
        "age_days": null
      },
      "clocks": {
        "source_as_of": null,
        "retrieved_at": "2026-08-29T19:08:32.165Z",
        "built_at": null,
        "observed_at": "2026-08-29T19:08:32.165Z"
      },
      "coverage": {
        "scope": "citywide",
        "status": "bounded-metadata-only",
        "row_count": 7478382,
        "available_zero": false,
        "exact_payload": false,
        "completeness_admitted": false
      },
      "dq": {
        "status": "partial",
        "observed_field_count": 11,
        "missing_fields": [],
        "flags": [
          "bounded-metadata-only"
        ]
      },
      "official_source_url": "https://opendataphilly.org/datasets/philadelphia-properties-and-assessment-history/",
      "limitations": [
        "Assessment-history readiness is bounded metadata only; no complete immutable parcel history or private join is admitted."
      ]
    },
    {
      "source_id": "real-estate-transfers",
      "ordinal": 3,
      "receipt_identity": "sha256:7503f97e532a573b0c56f1c77f792130d77f301b4abd827866b619860d0c685c",
      "status": "unavailable",
      "freshness": {
        "status": "stale",
        "max_age_days": 7,
        "age_days": 52.79353200231481
      },
      "clocks": {
        "source_as_of": "2026-07-08T00:05:51.000Z",
        "retrieved_at": "2026-08-29T19:08:32.165Z",
        "built_at": null,
        "observed_at": "2026-08-29T19:08:32.165Z"
      },
      "coverage": {
        "scope": "citywide",
        "status": "unavailable",
        "row_count": null,
        "available_zero": false,
        "exact_payload": false,
        "completeness_admitted": false
      },
      "dq": {
        "status": "unavailable",
        "observed_field_count": 51,
        "missing_fields": [],
        "flags": [
          "source-unavailable"
        ]
      },
      "official_source_url": "https://data.phila.gov/visualizations/real-estate-transfers/",
      "limitations": [
        "Transfer readiness does not admit a complete immutable transaction payload or private address-level join."
      ]
    },
    {
      "source_id": "philly311-requests",
      "ordinal": 4,
      "receipt_identity": "sha256:e314547a3108b64b913fde876922d7da9c17a17defbe0381f23dcbc6d013a7a8",
      "status": "partial",
      "freshness": {
        "status": "current",
        "max_age_days": 2,
        "age_days": 0.5416685763888889
      },
      "clocks": {
        "source_as_of": "2026-08-29T06:08:32.000Z",
        "retrieved_at": "2026-08-29T19:08:32.165Z",
        "built_at": null,
        "observed_at": "2026-08-29T19:08:32.165Z"
      },
      "coverage": {
        "scope": "citywide",
        "status": "bounded-metadata-only",
        "row_count": 5916965,
        "available_zero": false,
        "exact_payload": false,
        "completeness_admitted": false
      },
      "dq": {
        "status": "partial",
        "observed_field_count": 23,
        "missing_fields": [],
        "flags": [
          "bounded-metadata-only"
        ]
      },
      "official_source_url": "https://data.phila.gov/visualizations/311-requests/",
      "limitations": [
        "311 readiness is bounded metadata only; no complete request payload or private address-level join is admitted."
      ]
    },
    {
      "source_id": "li-property-history",
      "ordinal": 5,
      "receipt_identity": "sha256:b17d6223e31ba3e2fccb264a304cb7ecac163ec38c4cdf0b6b7c33dcf5089697",
      "status": "partial",
      "freshness": {
        "status": "current",
        "max_age_days": 3,
        "age_days": 2.0784625578703704
      },
      "clocks": {
        "source_as_of": "2026-08-27T17:15:33.000Z",
        "retrieved_at": "2026-08-29T19:08:32.165Z",
        "built_at": null,
        "observed_at": "2026-08-29T19:08:32.165Z"
      },
      "coverage": {
        "scope": "citywide",
        "status": "bounded-metadata-only",
        "row_count": 4549521,
        "available_zero": false,
        "exact_payload": false,
        "completeness_admitted": false
      },
      "dq": {
        "status": "partial",
        "observed_field_count": 71,
        "missing_fields": [],
        "flags": [
          "bounded-metadata-only"
        ]
      },
      "official_source_url": "https://opendataphilly.org/datasets/licenses-and-inspections-property-history/",
      "limitations": [
        "L&I readiness is bounded composite metadata only; no complete property-history payload or private join is admitted."
      ]
    },
    {
      "source_id": "vacant-property-indicators",
      "ordinal": 6,
      "receipt_identity": "sha256:ce817a221f2c6da876cecef989356aed158a4fef117647e41761bbdfafee6e36",
      "status": "partial",
      "freshness": {
        "status": "current",
        "max_age_days": 45,
        "age_days": 6.093527824074074
      },
      "clocks": {
        "source_as_of": "2026-08-23T16:53:51.361Z",
        "retrieved_at": "2026-08-29T19:08:32.165Z",
        "built_at": null,
        "observed_at": "2026-08-29T19:08:32.165Z"
      },
      "coverage": {
        "scope": "citywide",
        "status": "bounded-metadata-only",
        "row_count": 9041,
        "available_zero": false,
        "exact_payload": false,
        "completeness_admitted": false
      },
      "dq": {
        "status": "partial",
        "observed_field_count": 14,
        "missing_fields": [],
        "flags": [
          "bounded-metadata-only"
        ]
      },
      "official_source_url": "https://opendataphilly.org/datasets/vacant-property-indicators/",
      "limitations": [
        "Vacancy readiness is modeled likely-vacant context only; it is not field-confirmed occupancy or address-level evidence."
      ]
    },
    {
      "source_id": "philadelphia-reported-crime",
      "ordinal": 7,
      "receipt_identity": "sha256:94da2cbd79beb9545a649a95a5eefc4ff45dbcbfeb62777ee273ae5dac455baa",
      "status": "available",
      "freshness": {
        "status": "current",
        "max_age_days": 14,
        "age_days": 2.631622280092593
      },
      "clocks": {
        "source_as_of": "2026-08-27T03:59:00.000Z",
        "retrieved_at": "2026-08-29T05:51:38.545Z",
        "built_at": "2026-08-29T05:52:14.004Z",
        "observed_at": "2026-08-29T05:55:49.799Z"
      },
      "coverage": {
        "scope": "citywide",
        "status": "complete-exact-receipt",
        "row_count": 3586620,
        "available_zero": false,
        "exact_payload": true,
        "completeness_admitted": true
      },
      "dq": {
        "status": "pass",
        "observed_field_count": 17,